{"$schema":"https://json-schema.org/draft/2020-12/schema","$id":"https://nepa.local/schemas/calibration-baseline-handoff.schema.json","type":"object","additionalProperties":false,"required":["schema_version","lineage_id","consumer","selection_ref","selected_version","bundle_ref","assessment_ref","owner_approval_ref","selection_reason","satisfies"],"properties":{"schema_version":{"const":"4.0"},"lineage_id":{"type":"string","pattern":"^[0-9a-f]{64}$"},"consumer":{"const":"m1-4c"},"selection_ref":{"$ref":"#/$defs/ref"},"selected_version":{"enum":["v0","v1","v2"]},"bundle_ref":{"$ref":"#/$defs/ref"},"assessment_ref":{"$ref":"#/$defs/ref"},"owner_approval_ref":{"$ref":"#/$defs/ref"},"selection_reason":{"type":"string","minLength":1},"satisfies":{"type":"object","additionalProperties":false,"required":["baseline_2_of_3","protocol_neutrality","owner_signature","production_quality_proven"],"properties":{"baseline_2_of_3":{"const":true},"protocol_neutrality":{"const":true},"owner_signature":{"const":true},"production_quality_proven":{"const":false}}}},"$defs":{"ref":{"type":"object","additionalProperties":false,"required":["path","sha256"],"properties":{"path":{"type":"string","minLength":1},"sha256":{"type":"string","pattern":"^[0-9a-f]{64}$"}}}}}
