{"schema_version":"4.0","lineage_id":"aaaaaaaaaaaaaaaaaaaaaaaaaaaaaaaaaaaaaaaaaaaaaaaaaaaaaaaaaaaaaaaa","consumer":"m1-4c","selection_ref":{"path":"prompt-development/selection.json","sha256":"bbbbbbbbbbbbbbbbbbbbbbbbbbbbbbbbbbbbbbbbbbbbbbbbbbbbbbbbbbbbbbbb"},"selected_version":"v0","bundle_ref":{"path":"prompt-development/versions/v0/snapshot.json","sha256":"cccccccccccccccccccccccccccccccccccccccccccccccccccccccccccccccc"},"assessment_ref":{"path":"prompt-development/versions/v0/assessment-n003.json","sha256":"dddddddddddddddddddddddddddddddddddddddddddddddddddddddddddddddd"},"owner_approval_ref":{"path":"prompt-development/owner-approval.json","sha256":"eeeeeeeeeeeeeeeeeeeeeeeeeeeeeeeeeeeeeeeeeeeeeeeeeeeeeeeeeeeeeeee"},"selection_reason":"first version reaching the 2-of-3 baseline","satisfies":{"baseline_2_of_3":true,"protocol_neutrality":true,"owner_signature":true,"production_quality_proven":false}}
