{"assessment_ref":{"path":"prompt-development/versions/v0/assessment-n003.json","sha256":"9c7bfe8f48592956e99c843306b2b09f5722e8e9dbc96d88c25e7ccadbd2e92e"},"bundle_ref":{"path":"prompt-development/versions/v0/snapshot.json","sha256":"350382ded3f574f9d8180e7e5561b7079e3843f49fa8c95ef2304a25b1d83991"},"consumer":"m1-4c","lineage_id":"4420296f4dead63a3119c49106e234147f4a69a1f4f4aecda8fa562af7944ab7","owner_approval_ref":{"path":"prompt-development/owner-approval.json","sha256":"95d48c647a154879b30429e4b142dd3fa98c466d2a4a42a72cc291d211178f64"},"satisfies":{"baseline_2_of_3":true,"owner_signature":true,"production_quality_proven":false,"protocol_neutrality":true},"schema_version":"4.0","selected_version":"v0","selection_reason":"first passing version","selection_ref":{"path":"prompt-development/selection.json","sha256":"56f36fcea9e58bd1aa9944742bf5a26a464c92fb07ec91b36611d9ed90fca26e"}}